[
  {
    "beneficio_esperado_centavos": null,
    "classe_processual": "Procedimento do Juizado Especial Cível",
    "comarca": "São Paulo",
    "custo_recurso_centavos": null,
    "danos_materiais_centavos": 0,
    "danos_morais_centavos": 0,
    "data_citacao": null,
    "decisao_recurso": "nao_recorrer",
    "evidencias": {
      "data_citacao": null,
      "fundamento_decisao": "Acolho a preliminar de incompetência do Juizado Especial para processar e julgar a demanda (art. 3º c/c art. 51, II, da Lei 9.099/95).",
      "identificacao": "Processo nº 3094235-58.2024.8.26.0009",
      "mes_base_correcao": null,
      "resultado": "JULGO EXTINTO o processo SEM resolução de mérito, nos termos do art. 51, II, da Lei 9.099/95, facultado à parte autora o ajuizamento perante a Justiça Comum.",
      "tema": "cobrança de tarifas bancárias não contratadas",
      "valores": null
    },
    "fundamento_decisao": "Acolho a preliminar de incompetência do Juizado Especial para processar e julgar a demanda, extinguindo o processo sem resolução de mérito.",
    "juros_centavos": 0,
    "mes_base_correcao": null,
    "meses_completos": null,
    "motivo_decisao": "sem_condenacao",
    "numero_processo": "3094235-58.2024.8.26.0009",
    "principal_corrigido_centavos": 0,
    "probabilidade_reversao_percentual": 50,
    "problemas": [],
    "resultado_sentenca": "extincao",
    "status_processamento": "ok",
    "status_subsidios": "essenciais",
    "tema": "cobrança de tarifas bancárias não contratadas",
    "tribunal": "TJSP",
    "valor_atualizado_centavos": 0,
    "valor_condenacao_centavos": 0
  },
  {
    "beneficio_esperado_centavos": null,
    "classe_processual": "Procedimento do Juizado Especial Cível",
    "comarca": "São Paulo",
    "custo_recurso_centavos": null,
    "danos_materiais_centavos": 0,
    "danos_morais_centavos": 0,
    "data_citacao": null,
    "decisao_recurso": "nao_recorrer",
    "evidencias": {
      "data_citacao": null,
      "fundamento_decisao": "Acolho a preliminar de incompetência do Juizado Especial para processar e julgar a demanda (art. 3º c/c art. 51, II, da Lei 9.099/95).",
      "identificacao": "Processo nº 4226067-18.2024.8.26.0006",
      "mes_base_correcao": null,
      "resultado": "JULGO EXTINTO o processo SEM resolução de mérito, nos termos do art. 51, II, da Lei 9.099/95, facultado à parte autora o ajuizamento perante a Justiça Comum.",
      "tema": "Trata-se de ação fundada em produto entregue em desacordo com o anunciado.",
      "valores": null
    },
    "fundamento_decisao": "Acolho a preliminar de incompetência do Juizado Especial para processar e julgar a demanda (art. 3º c/c art. 51, II, da Lei 9.099/95).",
    "juros_centavos": 0,
    "mes_base_correcao": null,
    "meses_completos": null,
    "motivo_decisao": "sem_condenacao",
    "numero_processo": "4226067-18.2024.8.26.0006",
    "principal_corrigido_centavos": 0,
    "probabilidade_reversao_percentual": 80,
    "problemas": [],
    "resultado_sentenca": "extincao",
    "status_processamento": "ok",
    "status_subsidios": "completos",
    "tema": "produto entregue em desacordo com o anunciado",
    "tribunal": "TJSP",
    "valor_atualizado_centavos": 0,
    "valor_condenacao_centavos": 0
  },
  {
    "beneficio_esperado_centavos": null,
    "classe_processual": "Procedimento Comum Cível",
    "comarca": "São Paulo",
    "custo_recurso_centavos": null,
    "danos_materiais_centavos": 0,
    "danos_morais_centavos": 0,
    "data_citacao": null,
    "decisao_recurso": "nao_recorrer",
    "evidencias": {
      "data_citacao": null,
      "fundamento_decisao": null,
      "identificacao": "Processo nº 4905582-22.2025.8.26.0002",
      "mes_base_correcao": null,
      "resultado": "Ante o exposto, JULGO IMPROCEDENTE o pedido, com resolução de mérito (art. 487, I, do CPC).",
      "tema": "atraso de voo superior a quatro horas",
      "valores": null
    },
    "fundamento_decisao": null,
    "juros_centavos": 0,
    "mes_base_correcao": null,
    "meses_completos": null,
    "motivo_decisao": "sem_condenacao",
    "numero_processo": "4905582-22.2025.8.26.0002",
    "principal_corrigido_centavos": 0,
    "probabilidade_reversao_percentual": 50,
    "problemas": [],
    "resultado_sentenca": "improcedencia",
    "status_processamento": "ok",
    "status_subsidios": "essenciais",
    "tema": "atraso de voo superior a quatro horas",
    "tribunal": "TJSP",
    "valor_atualizado_centavos": 0,
    "valor_condenacao_centavos": 0
  },
  {
    "beneficio_esperado_centavos": -253269,
    "classe_processual": "Procedimento Comum Cível",
    "comarca": "São Paulo",
    "custo_recurso_centavos": 320000,
    "danos_materiais_centavos": 600000,
    "danos_morais_centavos": 30000,
    "data_citacao": "2026-02-27",
    "decisao_recurso": "nao_recorrer",
    "evidencias": {
      "data_citacao": "citação (27/02/2026)",
      "fundamento_decisao": "Reconheço o prejuízo material demonstrado, mas reputo excessivo o montante pretendido na inicial.",
      "identificacao": "Processo nº 3871230-78.2024.8.26.0002",
      "mes_base_correcao": "dezembro de 2025 (evento danoso)",
      "resultado": "JULGO PARCIALMENTE PROCEDENTE o pedido, com resolução de mérito (art. 487, I, do CPC), para CONDENAR a parte requerida ao pagamento de R$ 6.000,00 a título de danos materiais e R$ 300,00 a título de danos morais.",
      "tema": "cancelamento unilateral de plano de saúde",
      "valores": "CONDENAR a parte requerida ao pagamento de R$ 6.000,00 a título de danos materiais e R$ 300,00 a título de danos morais."
    },
    "fundamento_decisao": "Reconheço o prejuízo material demonstrado, mas reputo excessivo o montante pretendido na inicial.",
    "juros_centavos": 19436,
    "mes_base_correcao": "2025-12",
    "meses_completos": 3,
    "motivo_decisao": "beneficio_nao_positivo",
    "numero_processo": "3871230-78.2024.8.26.0002",
    "principal_corrigido_centavos": 647878,
    "probabilidade_reversao_percentual": 10,
    "problemas": [],
    "resultado_sentenca": "parcial_procedencia",
    "status_processamento": "ok",
    "status_subsidios": "ausentes",
    "tema": "cancelamento unilateral de plano de saúde",
    "tribunal": "TJSP",
    "valor_atualizado_centavos": 667314,
    "valor_condenacao_centavos": 630000
  },
  {
    "beneficio_esperado_centavos": null,
    "classe_processual": "Procedimento Comum Cível",
    "comarca": "São Paulo",
    "custo_recurso_centavos": null,
    "danos_materiais_centavos": 0,
    "danos_morais_centavos": 0,
    "data_citacao": null,
    "decisao_recurso": "nao_recorrer",
    "evidencias": {
      "data_citacao": null,
      "fundamento_decisao": "Antes da audiência, a parte autora manifestou expressamente o desejo de não prosseguir com a demanda, requerendo a desistência da ação.",
      "identificacao": "Processo nº 5528972-91.2024.8.26.0001",
      "mes_base_correcao": null,
      "resultado": "Ante o exposto, HOMOLOGO a desistência e JULGO EXTINTO o processo SEM resolução de mérito, nos termos do art. 485, VIII, do CPC.",
      "tema": "acidente de trânsito com danos ao veículo",
      "valores": null
    },
    "fundamento_decisao": "A parte autora manifestou expressamente o desejo de não prosseguir com a demanda, requerendo a desistência da ação, motivo pelo qual o processo foi extinto sem resolução de mérito.",
    "juros_centavos": 0,
    "mes_base_correcao": null,
    "meses_completos": null,
    "motivo_decisao": "sem_condenacao",
    "numero_processo": "5528972-91.2024.8.26.0001",
    "principal_corrigido_centavos": 0,
    "probabilidade_reversao_percentual": 80,
    "problemas": [],
    "resultado_sentenca": "extincao",
    "status_processamento": "ok",
    "status_subsidios": "completos",
    "tema": "acidente de trânsito com danos ao veículo",
    "tribunal": "TJSP",
    "valor_atualizado_centavos": 0,
    "valor_condenacao_centavos": 0
  },
  {
    "beneficio_esperado_centavos": -135740,
    "classe_processual": "Procedimento Comum Cível",
    "comarca": "São Paulo",
    "custo_recurso_centavos": 320000,
    "danos_materiais_centavos": 210000,
    "danos_morais_centavos": 80000,
    "data_citacao": "2024-12-11",
    "decisao_recurso": "nao_recorrer",
    "evidencias": {
      "data_citacao": "citação (11/12/2024)",
      "fundamento_decisao": "Reconheço o prejuízo material demonstrado, mas reputo excessivo o montante pretendido na inicial.",
      "identificacao": "Processo nº 4567281-93.2024.8.26.0006",
      "mes_base_correcao": "novembro de 2024 (evento danoso)",
      "resultado": "JULGO PARCIALMENTE PROCEDENTE o pedido, com resolução de mérito (art. 487, I, do CPC), para CONDENAR a parte requerida ao pagamento de R$ 2.100,00 a título de danos materiais e R$ 800,00 a título de danos morais.",
      "tema": "cobrança indevida em fatura",
      "valores": "CONDENAR a parte requerida ao pagamento de R$ 2.100,00 a título de danos materiais e R$ 800,00 a título de danos morais."
    },
    "fundamento_decisao": "Reconheço o prejuízo material demonstrado, mas reputo excessivo o montante pretendido na inicial.",
    "juros_centavos": 53546,
    "mes_base_correcao": "2024-11",
    "meses_completos": 17,
    "motivo_decisao": "beneficio_nao_positivo",
    "numero_processo": "4567281-93.2024.8.26.0006",
    "principal_corrigido_centavos": 314975,
    "probabilidade_reversao_percentual": 50,
    "problemas": [],
    "resultado_sentenca": "parcial_procedencia",
    "status_processamento": "ok",
    "status_subsidios": "essenciais",
    "tema": "cobrança indevida em fatura",
    "tribunal": "TJSP",
    "valor_atualizado_centavos": 368521,
    "valor_condenacao_centavos": 290000
  },
  {
    "beneficio_esperado_centavos": null,
    "classe_processual": "Procedimento Comum Cível",
    "comarca": "São Paulo",
    "custo_recurso_centavos": null,
    "danos_materiais_centavos": 0,
    "danos_morais_centavos": 0,
    "data_citacao": null,
    "decisao_recurso": "nao_recorrer",
    "evidencias": {